{
  "$schema": "../../../tests/lab/flows.schema.json",
  "id": "hostdrain",
  "name": "Host pod is stopped",
  "note": "A node drain or rollout stops a host pod running many agents.",
  "proof": [
    "S8"
  ],
  "source": "docs/prd/k2-distributed-runtime.html, FLOWS.hostdrain",
  "correlate": "host",
  "participants": [
    {
      "id": "kube",
      "name": "Kubernetes",
      "role": "kubelet"
    },
    {
      "id": "host",
      "name": "k2-host",
      "role": "host pod"
    },
    {
      "id": "cli",
      "name": "Agent CLIs",
      "role": "on this host"
    },
    {
      "id": "ctl",
      "name": "Controller",
      "role": ""
    }
  ],
  "steps": [
    {
      "n": 1,
      "from": "kube",
      "to": "host",
      "kind": "call",
      "label": "SIGTERM, grace 600 s",
      "event": "host.sigterm",
      "say": "Host pods set a long termination grace period and a PodDisruptionBudget, which StatefulSets support."
    },
    {
      "n": 2,
      "from": "host",
      "to": "ctl",
      "kind": "call",
      "label": "Draining{agents}",
      "event": "host.draining",
      "say": "The controller stops sending new work here and holds messages in the outbox."
    },
    {
      "n": 3,
      "from": "host",
      "to": "cli",
      "kind": "call",
      "label": "wait for each turn to end",
      "event": "host.wait_turn",
      "say": "Agents finish their current turn instead of being cut off mid-edit."
    },
    {
      "n": 4,
      "from": "cli",
      "to": "host",
      "kind": "reply",
      "label": "Stop hook",
      "event": "cli.hook",
      "match": {
        "hook": "Stop"
      },
      "say": "The Stop hook marks a turn boundary, a safe point to end the CLI."
    },
    {
      "n": 5,
      "from": "host",
      "to": "ctl",
      "kind": "call",
      "label": "Released{agent → session_id}",
      "event": "host.released",
      "say": "Each agent's session id is saved for resume."
    },
    {
      "n": 6,
      "from": "kube",
      "to": "host",
      "kind": "call",
      "label": "replacement pod, same volume",
      "event": "host.replaced",
      "say": "The StatefulSet brings the pod back with the same identity and volume."
    },
    {
      "n": 7,
      "from": "host",
      "to": "ctl",
      "kind": "call",
      "label": "enroll (same key)",
      "event": "host.enroll",
      "say": "The host reconnects as itself."
    },
    {
      "n": 8,
      "from": "ctl",
      "to": "host",
      "kind": "call",
      "label": "Spawn{resume} for agents that were awake",
      "event": "host.spawn",
      "say": "Agents that were awake before come back. Sleeping agents stay asleep."
    }
  ]
}
